{
  "v": "ACDC10JSON00011c_",
  "d": "E1qH1E2zo7rnW1Pwm3NuYOXZ1SsVH3yeV2Iifj2wtCgA",
  "i": "did:keri:EZBfSGG5k1CZYk1QH3GXFPtEwLHf0H06zuDUEJRyar1E",
  "ri": "did:keri:EymRy7xMwsxUelUauaXtMxTfPAMPAI6FkekwlOjkggt",
  "s": "EDg-Ji3kmi_G97Jctxeajpmp1-A8gSpeyElm-XCzTxiE",
  "a": "ErmVM5JGLewHJrSqIuhwWktoIlfffh7sHIGAQvtcFSU",
  "e": "EBDmgKOAEwnMGsofWg2m0l63J1awfJafqJyCzTnVkdSw",
  "r": "EDIai3Wkd-Z_4cezz9nYEcCK3KNH5saLvZoS_84JL6NU"
}
