{
  "v": "ACDC10JSON0004e4_",
  "d": "EuF1gpodKbbqS0fqmUiOYf-MusuNvi0OmY8Js6SKSdfE",
  "i": "EKXPX7hWw8KK5Y_Mxs2TOuCrGdN45vPIZ78NofRlVBws",
  "ri": "EuqwB_iOD86eK0ynAhA6AYwWvPeBhvmbcmOD-9cCmiVU",
  "s": "EDpuiVPt4_sa1pShx6vOCnseru1edVPeNvRaQm6HrmMI",
  "a": "E9-86Jag34CrJpfNFz_-7E5HA0Dj0FvcYNoFVe7qwkiI",
  "e": "EsOf5_YgX_64z4YuHNFWLUnIKcyvsVQOe_vJ_638X6gE",
  "r": "EDIai3Wkd-Z_4cezz9nYEcCK3KNH5saLvZoS_84JL6NU"
}
